{
  "schema_version": "1.0",
  "project_id": "001-the-ai-race-no-one-can-afford-to-win",
  "scenes": [
    {
      "scene_id": "scene_001",
      "asset_type": "video",
      "source": "pexels",
      "search_queries": [
        "rapid cross cuts data center office government building night",
        "anonymous AI office data center government facade tense race",
        "modern data center exterior at night technology campus",
        "institutional office building government district night"
      ],
      "selected_url": "https://www.pexels.com/video/aerial-view-footage-of-city-12719806/",
      "license": "https://www.pexels.com/license/",
      "license_verified_date": "20260712",
      "attribution_required": false,
      "attribution_text": null,
      "reasoning": "Scene-specific replacement for low-resolution opening asset; strong scene-opening relevance. Primary clip covers the opening technology/institutional pressure motif; supplemental montage recommended for all three storyboard motifs if editor needs literal cross-cuts.",
      "native_duration_sec": 23.786667,
      "native_resolution": {
        "width": 3840,
        "height": 2160
      },
      "expected_resolution": {
        "width": 3840,
        "height": 2160
      },
      "rendition_metadata_mismatch": null,
      "trim_in_sec": 0,
      "trim_out_sec": 23.786667,
      "fallback_to_ai_visual": false,
      "asset_role": "canonical",
      "asset_path": "assets/footage/scene_001_52c2ebe35b131555e20a5ab5.mp4",
      "provenance_path": "assets/footage/scene_001_52c2ebe35b131555e20a5ab5.mp4.provenance.json",
      "approved_for_final_edit": true,
      "editorial_quality_approved": true,
      "license_approved": true,
      "selected_rendition_id": "bc672a7273c79a4e7c80ac2a",
      "actual_resolution": {
        "width": 3840,
        "height": 2160
      },
      "source_page_url": "https://www.pexels.com/video/aerial-view-footage-of-city-12719806/"
    },
    {
      "scene_id": "scene_002",
      "asset_type": "video",
      "source": "pixabay",
      "search_queries": [
        "AI safety report laboratory documents",
        "technical report institutional technology warning"
      ],
      "selected_url": "https://pixabay.com/videos/id-39183/",
      "license": "https://pixabay.com/service/license-summary/",
      "license_verified_date": "20260711",
      "attribution_required": false,
      "attribution_text": null,
      "reasoning": "Provider-fix corrective rerun with scene-specific search and full rendition metadata.",
      "native_duration_sec": 6,
      "native_resolution": {
        "width": 1920,
        "height": 1080
      },
      "trim_in_sec": 0,
      "trim_out_sec": 6.0,
      "fallback_to_ai_visual": false,
      "approved_for_final_edit": true,
      "editorial_quality_approved": true,
      "license_approved": true,
      "asset_path": "assets/footage/scene_002_55b0a8af17f137fd76d52766.mp4",
      "provenance_path": "assets/footage/scene_002_55b0a8af17f137fd76d52766.mp4.provenance.json",
      "asset_role": "canonical",
      "selected_rendition_id": "328bbd26220bb91dc65c817f",
      "legacy_provenance_schema": true,
      "explicit_binding_status": "NOT_RECORDED_PRE_SCHEMA",
      "media_sha_ffprobe_valid": true,
      "actual_resolution": {
        "width": 1920,
        "height": 1080
      },
      "source_page_url": "https://pixabay.com/videos/id-39183/"
    },
    {
      "scene_id": "scene_003",
      "asset_type": "video",
      "source": "pexels",
      "search_queries": [
        "secure research laboratory corridor technology",
        "controlled software model evaluation laboratory"
      ],
      "selected_url": "https://www.pexels.com/video/a-man-looking-at-a-blueprint-on-his-laptop-6224298/",
      "license": "https://www.pexels.com/license/",
      "license_verified_date": "20260711",
      "attribution_required": false,
      "attribution_text": null,
      "reasoning": "Provider-fix corrective rerun with scene-specific search and full rendition metadata.",
      "native_duration_sec": 18,
      "native_resolution": {
        "width": 1920,
        "height": 1080
      },
      "trim_in_sec": 0,
      "trim_out_sec": 18.0,
      "fallback_to_ai_visual": false,
      "approved_for_final_edit": true,
      "editorial_quality_approved": true,
      "license_approved": true,
      "asset_path": "assets/footage/scene_003_d69cde76dfac1e29bd6f9946.mp4",
      "provenance_path": "assets/footage/scene_003_d69cde76dfac1e29bd6f9946.mp4.provenance.json",
      "asset_role": "canonical",
      "selected_rendition_id": "7456dd0377a5f51a77f781b2",
      "legacy_provenance_schema": true,
      "explicit_binding_status": "NOT_RECORDED_PRE_SCHEMA",
      "media_sha_ffprobe_valid": true,
      "actual_resolution": {
        "width": 1920,
        "height": 1080
      },
      "source_page_url": "https://www.pexels.com/video/a-man-looking-at-a-blueprint-on-his-laptop-6224298/"
    },
    {
      "scene_id": "scene_004",
      "asset_type": "video",
      "source": "pixabay",
      "search_queries": [
        "software monitoring dashboard control room",
        "technical test environment dashboard monitors"
      ],
      "selected_url": "https://pixabay.com/videos/id-1210/",
      "license": "https://pixabay.com/service/license-summary/",
      "license_verified_date": "20260711",
      "attribution_required": false,
      "attribution_text": null,
      "reasoning": "Provider-fix corrective rerun with scene-specific search and full rendition metadata.",
      "native_duration_sec": 10,
      "native_resolution": {
        "width": 1920,
        "height": 1080
      },
      "trim_in_sec": 0,
      "trim_out_sec": 10.0,
      "fallback_to_ai_visual": false,
      "approved_for_final_edit": true,
      "editorial_quality_approved": true,
      "license_approved": true,
      "asset_path": "assets/footage/scene_004_52abd7f745cc24b4ecad0215.mp4",
      "provenance_path": "assets/footage/scene_004_52abd7f745cc24b4ecad0215.mp4.provenance.json",
      "asset_role": "canonical",
      "selected_rendition_id": "f60626ab55819f58249ee60f",
      "legacy_provenance_schema": true,
      "explicit_binding_status": "NOT_RECORDED_PRE_SCHEMA",
      "media_sha_ffprobe_valid": true,
      "actual_resolution": {
        "width": 1920,
        "height": 1080
      },
      "source_page_url": "https://pixabay.com/videos/id-1210/"
    },
    {
      "scene_id": "scene_005",
      "asset_type": "video",
      "source": "pixabay",
      "search_queries": [
        "abstract message exchange computer screen",
        "conceptual test transcript interface"
      ],
      "selected_url": "https://pixabay.com/videos/id-1058/",
      "license": "https://pixabay.com/service/license-summary/",
      "license_verified_date": "20260711",
      "attribution_required": false,
      "attribution_text": null,
      "reasoning": "Provider-fix corrective rerun with scene-specific search and full rendition metadata.",
      "native_duration_sec": 12,
      "native_resolution": {
        "width": 1920,
        "height": 1080
      },
      "trim_in_sec": 0,
      "trim_out_sec": 12.0,
      "fallback_to_ai_visual": false,
      "approved_for_final_edit": true,
      "editorial_quality_approved": true,
      "license_approved": true,
      "asset_path": "assets/footage/scene_005_e98a421f0d9c432e4d2036fb.mp4",
      "provenance_path": "assets/footage/scene_005_e98a421f0d9c432e4d2036fb.mp4.provenance.json",
      "asset_role": "canonical",
      "selected_rendition_id": "58346ceafdbb66f46b8a432a",
      "legacy_provenance_schema": true,
      "explicit_binding_status": "NOT_RECORDED_PRE_SCHEMA",
      "media_sha_ffprobe_valid": true,
      "actual_resolution": {
        "width": 1920,
        "height": 1080
      },
      "source_page_url": "https://pixabay.com/videos/id-1058/"
    },
    {
      "scene_id": "scene_006",
      "asset_type": "video",
      "source": "pixabay",
      "search_queries": [
        "fire drill alarm test office safety training",
        "emergency alarm test drill building"
      ],
      "selected_url": "https://pixabay.com/videos/id-15629/",
      "license": null,
      "license_verified_date": "20260712",
      "attribution_required": false,
      "attribution_text": null,
      "reasoning": "Provider-fix corrective rerun with scene-specific search and full rendition metadata for scene_006-scene_009 only.",
      "native_duration_sec": 10.687,
      "native_resolution": {
        "width": 4096,
        "height": 2160
      },
      "trim_in_sec": 0,
      "trim_out_sec": 10.687,
      "fallback_to_ai_visual": false,
      "approved_for_final_edit": true,
      "editorial_quality_approved": true,
      "license_approved": true,
      "asset_path": "assets/footage/scene_006_7e0d77fb76615c10d441204a.mp4",
      "provenance_path": "assets/footage/scene_006_7e0d77fb76615c10d441204a.mp4.provenance.json",
      "asset_role": "canonical",
      "selected_rendition_id": "c22dd975ed143a1a984adad9",
      "legacy_provenance_schema": true,
      "explicit_binding_status": "NOT_RECORDED_PRE_SCHEMA",
      "media_sha_ffprobe_valid": true,
      "actual_resolution": {
        "width": 4096,
        "height": 2160
      },
      "source_page_url": "https://pixabay.com/videos/id-15629/"
    },
    {
      "scene_id": "scene_007",
      "asset_type": "video",
      "source": "pexels",
      "search_queries": [
        "business boardroom strategy meeting executives",
        "tense corporate meeting boardroom"
      ],
      "selected_url": "https://www.pexels.com/video/women-talking-in-the-office-8170427/",
      "license": "https://www.pexels.com/license/",
      "license_verified_date": "20260712",
      "attribution_required": false,
      "attribution_text": null,
      "reasoning": "Provider-fix corrective rerun with scene-specific search; adjusted to landscape 1080p+ source for final edit compatibility.",